{
  "$schema": "https://json-schema.org/draft/2020-12/schema",
  "$id": "https://amxv.dev/finetuning/training-spec-v1.schema.json",
  "type": "object",
  "additionalProperties": false,
  "required": ["trainingSpecVersion", "runId", "dataset", "recipeId", "outputDirectory", "objective", "seed"],
  "properties": {
    "trainingSpecVersion": { "const": "1.0.0" },
    "qualificationSchemaVersion": { "const": "2.0.0" },
    "runId": { "type": "string", "minLength": 1 },
    "dataset": {
      "type": "object",
      "additionalProperties": false,
      "required": ["manifestPath", "recordsHash"],
      "properties": {
        "manifestPath": { "type": "string" },
        "recordsHash": { "type": "string", "pattern": "^[a-f0-9]{64}$" }
      }
    },
    "recipeId": { "type": "string" },
    "outputDirectory": { "type": "string" },
    "objective": { "const": "sft" },
    "seed": { "type": "integer", "minimum": 0 },
    "operation": { "enum": ["prepare", "run", "resume", "status", "evaluate", "export"] },
    "checkpointPath": { "type": "string" },
    "quantization": { "enum": ["4bit", "8bit", "bf16"] },
    "adapter": { "enum": ["lora", "qlora", "full"] },
    "trustRemoteCode": { "type": "boolean" },
    "executionGates": {
      "type": "object",
      "additionalProperties": false,
      "required": ["allowModelLoad", "licenseApproved", "revisionPinned", "remoteCodeReviewed", "gpuQualified"],
      "properties": {
        "allowModelLoad": { "type": "boolean" },
        "licenseApproved": { "type": "boolean" },
        "revisionPinned": { "type": "boolean" },
        "remoteCodeReviewed": { "type": "boolean" },
        "gpuQualified": { "type": "boolean" },
        "networkApproved": { "type": "boolean" },
        "downloadsApproved": { "type": "boolean" },
        "budgetApproved": { "type": "boolean" },
        "datasetRightsApproved": { "type": "boolean" },
        "uploadApproved": { "type": "boolean" },
        "architectureQualified": { "type": "boolean" },
        "frameworkQualified": { "type": "boolean" },
        "customKernelApproved": { "type": "boolean" }
      }
    },
    "recipeIdentity": {
      "type": "object",
      "additionalProperties": false,
      "required": ["modelRevision", "tokenizerRevision"],
      "properties": {
        "modelRevision": { "type": "string", "pattern": "^[a-f0-9]{40}$" },
        "tokenizerRevision": { "type": "string", "pattern": "^[a-f0-9]{40}$" },
        "templateHash": { "type": "string", "pattern": "^[a-f0-9]{64}$" },
        "reasoningPolicy": { "type": "string" }
      }
    },
    "trainingArguments": { "type": "object" }
  }
}
